Title,Artist
Ya Hey,Vampire Weekend
Ya Hey,Phosphorescent
Ya Ya,Lee Dorsey
Yeah Yeah Yeah Song,The Flaming Lips
Year Of The Cat,Al Stewart
Yellow,Coldplay
Yellow Eyes,RayLand Baxter
Yellow Ledbetter,Pearl Jam
Yellow Moon,Neville Brothers
Yellow Submarine,The Beatles
Yer Blues,The Beatles
"Yes, I'm Ready",Barbara Mason
Yes We Can Can,Allen Toussaint
Yes We Can Can,The Pointer Sisters
Yesterday,The Beatles
Yesterday's News,Whiskeytown
"Yester-Me, Yester-You, Yesterday",Stevie Wonder
You,Ben Arnold
You,Marvin Gaye
You & I,Margaret Glaspy
You Ain't Going Nowhere,The Byrds
You Ain't Seen Nothing Yet,Bachman-Turner Overdrive
You And I,Wilco
You And Your Sister,Chris Bell
You Are A Tourist,Death Cab For Cutie
You Are In My System,Robert Palmer
You Are The Best Thing,Ray Lamontagne
You Are The Sunshine Of My Life,Stevie Wonder
You Be Illin',Run-DMC
You Belong To Me,Elvis Costello
You Belong To Me,The Doobie Brothers
You Better You Bet,The Who
You Bowed Down,Roger McGuinn
You Can All Join In,Traffic
You Can Bring Me Flowers,Ray Lamontagne
You Can Call Me Al,Paul Simon
You Can Get It If You Really Want,Jimmy Cliff
You Can Leave Your Hat On,Randy Newman
You Can Look (But You Better Not Touch),Bruce Springsteen
You Can Make It If You Try,Sly & The Family Stone
You Cannot Win If You Do Not Play,Steve Forbert
You Can't Always Get What You Want,The Rolling Stones
You Can't Be Told,Valerie June
You Can't Buy My Love,Robert Plant
You Can't Catch Me,Chuck Berry
You Can't Do That,The Beatles
You Can't Get What You Want,Joe Jackson
You Can't Hide,Maktub
You Can't Hurry Love,The Supremes
You Can't Judge A Book By Its Cover,Bo Diddley
You Cried Wolf,Todd Rundgren
You Dance,Eastmountainsouth
You Don't Have To Cry,Crosby Stills & Nash
You Don't Know Like I Know,Sam & Dave
You Don't Move Me,Keith Richards
You Don't Treat Me No Good,Sonia Dada
You Gave Me The Answer,Wings
You Get What You Deserve,Big Star
You Get What You Give,New Radicals
You Go Down Smooth,Lake Street Dive
You Got It,Bonnie Raitt
You Got It,Roy Orbison
You Got Lucky,Tom Petty & The Heartbreakers
You Gotta Move,The Rolling Stones
You Gotta Move,The Rolling Stones
You Got The Silver,The Rolling Stones
You Got My Letter,Boz Scaggs
You Got What It Takes,Joe Tex
You Got Yr. Cherry Bomb,Spoon
You Haven't Done Nothin',Stevie Wonder
You Keep Me Hanging On,Diana Ross & The Supremes
You Keep Me Hanging On,Vanilla Fudge
You Keep Me Hanging On,Vanilla Fudge
You Know I'm No Good,Amy Winehouse
You Know My Name (Look Up The Number),The Beatles
You Love The Thunder,Jackson Browne
You Made Me The Thief Of Your Heart,Sinead O'Connor
You Make It So Hard,Boz Scaggs
You Make Loving Fun,Fleetwood Mac
You May Be Right,Billy Joel
You Must Be Good For Something,Hall & Oates
You Need Love,Muddy Waters
You Need To Be With Me,Susan Tedeschi
You Never Can Tell,Chuck Berry
You Never Know,Wilco
You Never Give Me Your Money,The Beatles
You Never Need Nobody,The Lone Bellow
You Only Live Once,The Strokes
You Really Got Me,The Kinks
You Send Me,Sam Cooke
You Set The Scene,Love
You Sexy Thing,Hot Chocolate
You Shook Me,Jeff Beck
You Shook Me All Night Long,AC/DC
You Should Be Dancing,Bee Gees
You Showed Me,The Lightning Seeds
You Showed Me,The Turtles
You Spin Me Round,Dead Or Alive
"You Turn Me On, I'm A Radio",Joni Mitchell
You Want It Darker,Leonard Cohen
You Wear It Well,Rod Stewart
You Were Never There,Diego Garcia
You Woke Up My Neighborhood,Billy Bragg
You Won't See Me,The Beatles
Young Americans,David Bowie
Young Folks,Peter Bjorn And John
Young Gifted and Black,Aretha Franklin
Your Body Is A Wonderland,John Mayer
Your Bright Baby Blues,Jackson Browne
Your Cheatin' Heart,Hank Williams
Your Eyes Open,Keane
Your Ghost,Kristin Hersh
Your Gold Teeth,Steely Dan
Your Lies,Shelby Lynne
Your Lips,Olu Dara
Your Love,Middle Kids
Your Love Is Killing Me,Sharon Van Etten
Your Mind Is On Vacation,Mose Allison
Your Mother Should Know,The Beatles
Your Own Special Way,Genesis
Your Own Special Way,Genesis
Your Own Sweet Way,The Notting Hillbillies
Your Song,Elton John
Your Time Is Gonna Come,Led Zeppelin
Your Touch,The Black Keys
Your Wildest Dreams,The Moody Blues
Your Woman,White Town
You're A Big Girl Now,Bob Dylan
You're Aging Well,Joan Baez
You're A Wolf,Sea Wolf
You're All I Need To Get By,Marvin Gaye & Tammi Terrell
You're All I've Got Tonight,The Cars
You're Crazy For Taking The Bus,Jonathan Richman
You're Going To Lose That Girl,The Beatles
You're Gonna Make Me Lonesome When You Go,Bob Dylan
You're Gonna Make Me Lonesome When You Go,Shawn Colvin
You're Gonna Make Me Lonesome When You Go,Shawn Colvin
You're Gonna Get What's Coming,Robert Palmer
You're Gonna Miss Me,13th Floor Elevators
You're Much Too Soon,Hall & Oates
You're My Best Friend,Queen
You're My Favorite Waste Of Time,Marshall Crenshaw
You're Only Lonely,J.D. Souther
You're Playing Us Too Close,Third World
You're Right (I'm Wrong),Colvin & Earle
You're No Good,Linda Ronstadt
You're So Vain,Carly Simon
"You're The First, The Last, My Everything",Barry White
You're The One,Paul Simon
You're The One,Tracy Chapman
Yours Is No Disgrace,Yes
You've Been In Love Too Long,Bonnie Raitt
You've Got A Friend,Carole King
You've Got A Friend,James Taylor
You've Got It Bad Girl,Stevie Wonder
You've Got To Hide Your Love Away,The Beatles
You've Lost That Lovin' Feelin',The Righteous Brothers
You've Really Got A Hold On Me,Smokey Robinson & The Miracles
"Yummy, Yummy, Yummy",The Ohio Express
